{
  "category": "illegal_dumping",
  "region": {
    "sido": "서울특별시",
    "sigungu": "동작구",
    "dong": "상도동",
    "place_text": "상도동 주민센터 앞"
  },
  "channels": [
    {
      "channel_id": "national-all-01",
      "name": "국민신문고",
      "org": "국민권익위원회",
      "method": "web",
      "url": "https://www.epeople.go.kr/",
      "jurisdiction": "전국",
      "verified_at": "2026-10-06",
      "source_url": "https://www.epeople.go.kr/"
    },
    {
      "channel_id": "national-all-02",
      "name": "안전신문고",
      "org": "행정안전부",
      "method": "web",
      "url": "https://www.safetyreport.go.kr/",
      "jurisdiction": "전국",
      "verified_at": "2026-10-06",
      "source_url": "https://www.safetyreport.go.kr/"
    }
  ],
  "draft": {
    "title": "동작구 상도동 쓰레기 무단투기 신고",
    "body": "상도동 주민센터 앞에서 어제 쓰레기 무단투기 문제를 확인했습니다. 확인과 조치를 부탁드립니다.",
    "fill_in": [],
    "removed_pii": []
  },
  "confirm_needed": [
    "스텁 결과입니다. 실제 민원 안내 전에 담당자 구현과 검증이 필요합니다."
  ],
  "sources": [
    {
      "url": "https://www.epeople.go.kr/",
      "checked_at": "2026-10-06"
    },
    {
      "url": "https://www.safetyreport.go.kr/",
      "checked_at": "2026-10-06"
    }
  ]
}
